[
  {
    "id": "g3-build-sent-001",
    "grade": 3,
    "workoutType": "build_sentence",
    "title": "The Running Dog",
    "targetSkill": "sentence_variety",
    "difficulty": 1,
    "prompt": "The dog ran.",
    "scaffolding": [
      { "step": 1, "label": "Where?", "question": "Where did the dog run?", "placeholder": "across the muddy yard..." },
      { "step": 2, "label": "How?", "question": "How did the dog move?", "placeholder": "like lightning, stumbling..." },
      { "step": 3, "label": "Why?", "question": "Why was the dog running?", "placeholder": "chasing an escaped tennis ball..." }
    ],
    "fallbackHints": [
      "Can you tell us *where* the dog was heading?",
      "Add one word describing how the dog moved (dashed, scampered, bolted).",
      "Explain *why* the dog was in such a hurry."
    ],
    "localEvaluationRules": {
      "minWordCount": 8,
      "bannedWords": ["went", "runned"],
      "suggestedKeywords": ["because", "toward", "suddenly", "through", "across"],
      "requiresConnector": true
    }
  },
  {
    "id": "g3-add-detail-001",
    "grade": 3,
    "workoutType": "add_detail",
    "title": "Park Adventure",
    "targetSkill": "sensory_details",
    "difficulty": 1,
    "prompt": "I went to the park.",
    "scaffolding": [
      { "step": 1, "label": "Sight", "question": "What did you see first?", "placeholder": "giant red swings..." },
      { "step": 2, "label": "Sound", "question": "What did you hear around you?", "placeholder": "leaves rustling, kids laughing..." },
      { "step": 3, "label": "Feeling", "question": "How did you feel being there?", "placeholder": "shivering with excitement..." }
    ],
    "fallbackHints": [
      "What did the air smell or feel like?",
      "Name one specific thing you played on or saw.",
      "Replace 'went' with an action showing how you got there."
    ],
    "localEvaluationRules": {
      "minWordCount": 10,
      "bannedWords": ["good", "fun", "nice"],
      "suggestedKeywords": ["cold", "creaked", "shadows", "breeze", "yellow"],
      "requiresConnector": false
    }
  },
  {
    "id": "g3-surg-001",
    "grade": 3,
    "workoutType": "sentence_surgery",
    "title": "The Mysterious Room",
    "targetSkill": "vocabulary",
    "difficulty": 2,
    "prompt": "The boy went into the room because he was scared.",
    "scaffolding": [
      { "step": 1, "label": "Upgrade Verb", "question": "Replace 'went' with a verb showing fear.", "placeholder": "crept, tiptoed, slipped..." },
      { "step": 2, "label": "Paint the Room", "question": "What made the room feel scary?", "placeholder": "the shadowy attic, the squeaky basement..." },
      { "step": 3, "label": "Show the Fear", "question": "Instead of saying 'he was scared', what was his body doing?", "placeholder": "teeth chattering, heart pounding..." }
    ],
    "fallbackHints": [
      "Show how his hands or eyes reacted rather than saying 'scared'.",
      "Which verb fits best: tiptoed, marched, or scrambled?",
      "Describe the light in the room (dim, flickering, pitch-black)."
    ],
    "localEvaluationRules": {
      "minWordCount": 12,
      "bannedWords": ["went", "scared", "bad"],
      "suggestedKeywords": ["crept", "darkness", "shivering", "whispered", "shadow"],
      "requiresConnector": true
    }
  },
  {
    "id": "g3-detective-001",
    "grade": 3,
    "workoutType": "writing_detective",
    "title": "The Repetitive Cat",
    "targetSkill": "sentence_variety",
    "difficulty": 2,
    "prompt": "The cat was nice. The cat liked milk. The cat saw a bug. The cat got the bug. It was a good day for the cat.",
    "scaffolding": [
      { "step": 1, "label": "Clue 1", "question": "What word starts almost every single sentence?", "placeholder": "Look at the first two words..." },
      { "step": 2, "label": "Clue 2", "question": "What weak adjectives did the author use?", "placeholder": "Check the first and last sentences..." },
      { "step": 3, "label": "Solve & Rewrite", "question": "Combine at least two sentences so 'The cat' isn't repeated.", "placeholder": "Write your polished revision here..." }
    ],
    "fallbackHints": [
      "Try using 'she' or 'the fluffy hunter' instead of 'The cat' every time.",
      "Combine two short ideas using 'and' or 'when'.",
      "Replace 'got the bug' with a vivid action verb like 'pounced'."
    ],
    "localEvaluationRules": {
      "minWordCount": 15,
      "bannedWords": ["nice", "good"],
      "suggestedKeywords": ["pounced", "lapped", "purred", "crept", "suddenly"],
      "requiresConnector": true
    }
  },
  {
    "id": "g3-para-001",
    "grade": 3,
    "workoutType": "build_paragraph",
    "title": "The Best Superhero Power",
    "targetSkill": "organization",
    "difficulty": 3,
    "prompt": "Choose one superpower and explain why it is the most useful.",
    "scaffolding": [
      { "step": 1, "label": "Main Idea", "question": "What is the best superpower?", "placeholder": "Invisibility is clearly the most useful power..." },
      { "step": 2, "label": "Detail 1", "question": "Give one everyday situation where this power helps.", "placeholder": "For example, you could slip past danger..." },
      { "step": 3, "label": "Detail 2", "question": "Give a second reason or fun example.", "placeholder": "It would also allow you to..." },
      { "step": 4, "label": "Ending", "question": "Wrap it up by reminding the reader of your main idea.", "placeholder": "That is why having the power to..." }
    ],
    "fallbackHints": [
      "Start with a strong opinion sentence.",
      "Use transition words like 'First,' 'Also,' or 'Most importantly.'",
      "Make your closing sentence mirror your opening sentence in a new way."
    ],
    "localEvaluationRules": {
      "minWordCount": 25,
      "bannedWords": ["stuff", "things"],
      "suggestedKeywords": ["first", "because", "also", "finally", "shows"],
      "requiresConnector": true
    }
  }
]
